Created_at,Tweet,Retweet_count,Favourite_count,User,Followers,Location,Tweet_polarity,Category
2023-01-05 14:12:25+00:00,"And two days of crying, and one lost hope, lol.",561,0,SamuellaPalmer,402,London,1,SI
2023-01-05 14:09:51+00:00,Pink pen and highlighter.,0,2,SamuellaPalmer,402,London,0,SI
2023-01-04 23:00:48+00:00,"I'm far from okay but at least these sketches are not, lol. ",18,0,SamuellaPalmer,402,London,1,SI
2023-01-04 20:52:39+00:00,I'm tired of living.,0,11,SamuellaPalmer,402,London,2,SI
2023-01-08 03:05:35+00:00,Wasted day. Time to go to sleep.,0,0,marzipanladya,801,Poland,2,SC
2023-01-08 01:40:14+00:00,"Body dysmorphia hit hard tonight, I almost cried after I saw the group pics, lol.",0,0,marzipanladya,801,Poland,1,SC
2023-01-08 01:39:12+00:00,Unbelievable that I have to leave the house when I have an idea and a will to draw.,2,6,marzipanladya,801,Poland,2,SC
2023-01-07 21:33:41+00:00,Cause all this greek mythology made me think about this drawing idea...,0,0,marzipanladya,801,Poland,0,SC
2023-01-06 20:43:39+00:00,Good day to LauriEven shippers only.,0,1,marzipanladya,801,Poland,0,SC
2023-01-06 01:55:39+00:00,"Too late to write it down and my head is empty already, and it was the best version so far ",0,1,marzipanladya,801,Poland,1,SC
2023-01-06 00:09:30+00:00,"Thinking about Erwan and Lauren's first kiss dialogue. 
Erwan is such a pathetic old man, lol.",0,1,marzipanladya,801,Poland,0,SC
2023-01-05 19:09:25+00:00,9. Erwan's dream was to become an athlete. Soccer was his passion but he took the medic path because of his parents.,0,2,marzipanladya,801,Poland,0,SC
2023-01-05 17:28:19+00:00, No escape.,0,3,marzipanladya,801,Poland,1,SC
2023-01-05 13:58:08+00:00,"It's only 4pm and I'm sooo sleepy, I wanna draw but I'm sooo sleepy, can't play games cause I'm sooo sleepy, can't ",0,6,marzipanladya,801,Poland,1,SC
2023-01-04 22:29:40+00:00,Finally reached Hades boss fight... o(-(,0,1,marzipanladya,801,Poland,2,SC
2023-01-04 22:13:37+00:00,"28 in February. 
And I've no money and no prospects. I'm still a burden to my parents. And I'm frightened. ",0,5,marzipanladya,801,Poland,2,SC
2023-01-04 18:18:34+00:00, Thank you ,0,2,marzipanladya,801,Poland,0,SC
2023-01-04 16:18:32+00:00,Remember when I was obsessed with Noctis back in 2006 when they showed the first trailer.,0,1,marzipanladya,801,Poland,0,SC
2023-01-04 15:09:31+00:00,"Ok, another game thread, FFXV time:
Pushing a car with 'Stand by me' playing in the distance was not a mission I expected, lol.",0,1,marzipanladya,801,Poland,0,SC
2023-01-04 14:31:18+00:00,I need to go back to therapytired of living in survival mode,0,1,marzipanladya,801,Poland,2,SC
2023-01-03 22:21:18+00:00,I need to go back to therapytired of living in survival mode,0,2,marzipanladya,801,Poland,2,SC
2023-01-03 21:21:42+00:00,Ive survived Downs,0,1,marzipanladya,801,Poland,0,SC
2023-01-03 21:15:35+00:00,What the FUCK is happening with me ,0,2,marzipanladya,801,Poland,2,SC
2023-01-03 21:07:58+00:00,"Once they sta saying its complicated,run for your life my sister",0,4,marzipanladya,801,Poland,2,SC
2023-01-07 21:32:54+00:00,Thought I will die in your arms,0,0,OngcweleHolly,37,"Pretoria, South Africa",2,SC
2022-11-25 20:28:32+00:00,Am back and ready to make someones son miserable,0,0,OngcweleHolly,37,"Pretoria, South Africa",1,SC
2022-11-16 17:41:04+00:00,Me mtakabawo! ,0,0,OngcweleHolly,37,"Pretoria, South Africa",0,SC
2022-11-13 16:45:24+00:00,And am done now ,0,0,OngcweleHolly,37,"Pretoria, South Africa",0,SC
2022-10-20 02:08:09+00:00,  I wanna hug someone tightly and cry.,0,0,OngcweleHolly,37,"Pretoria, South Africa",1,SC
2022-10-16 16:39:49+00:00,  It scares me how temporary everything is.,0,0,OngcweleHolly,37,"Pretoria, South Africa",1,SC
2022-10-06 18:58:24+00:00,"  I accepted it already, but it still makes me sad.",0,0,OngcweleHolly,37,"Pretoria, South Africa",1,SC
2022-10-02 16:28:09+00:00,According to Woke the are 876 gendersGod why am I still single ,585,0,OngcweleHolly,37,"Pretoria, South Africa",2,SC
2022-09-30 22:37:32+00:00,As fuck ,8951,0,OngcweleHolly,37,"Pretoria, South Africa",1,SC
2022-09-24 19:06:12+00:00, My everyday struggle or the phone is off!,0,0,OngcweleHolly,37,"Pretoria, South Africa",2,SC
2022-09-15 19:25:17+00:00,"I have no strength left in me, Im tired of fighting back. All my dreams are shattered, I really dont feel like li ",0,0,OngcweleHolly,37,"Pretoria, South Africa",2,SC
2022-09-14 06:49:33+00:00, Life ,0,0,OngcweleHolly,37,"Pretoria, South Africa",0,SC
2022-09-12 10:00:03+00:00,Analyst on crack. This was one bad game and still alot of games to go. Never write off Real Madrid. Never disrespec ,0,1,OngcweleHolly,37,"Pretoria, South Africa",0,SC
2022-09-09 15:21:32+00:00,"Thinking about my dad after a long time all of a sudden? Universe, bro why?",0,1,OngcweleHolly,37,"Pretoria, South Africa",2,SC
2023-01-07 21:32:06+00:00,Ya Allah please give me sabr and 12 Cats..,0,1,Khairdaykana,218,Lahore,0,SC
2023-01-07 22:02:40+00:00,"I have no strength left in me, I'm tired of fighting back. All my dreams are shattered, I really don't feel like li ",0,1,Khairdaykana,218,Lahore,2,SC
2023-01-07 21:51:09+00:00,  Ignore the haters Vincent. You GOAT of Villains. Easily,0,1,Khairdaykana,218,Lahore,0,SC
2023-01-07 21:50:40+00:00,Chacha khrhich mrhich ,0,0,Khairdaykana,218,Lahore,0,SC
2023-01-07 21:49:29+00:00,"I miss you more than I can bear, it's been nothing but a lonely world without you in it ",0,1,Khairdaykana,218,Lahore,1,SC
2023-01-07 21:47:34+00:00,Bro. How do I get out of this.  ,0,0,Khairdaykana,218,Lahore,2,SC
2023-01-07 21:32:06+00:00,  me irl ,0,1,Khairdaykana,218,Lahore,0,SC
2023-01-07 21:26:10+00:00,What's right with them? ,0,0,Khairdaykana,218,Lahore,2,SC
2023-01-07 21:20:42+00:00, Uncultured breed tbh.,0,2,Khairdaykana,218,Lahore,2,SC
2023-01-07 21:18:49+00:00, Attac,0,0,Khairdaykana,218,Lahore,1,SC
2023-01-07 20:52:41+00:00, May Allah give her speedy recovery. Ameen.,8,0,Khairdaykana,218,Lahore,0,SC
2023-01-07 19:52:39+00:00,Kuch theak Nahi hoga,0,1,Khairdaykana,218,Lahore,0,SC
2023-01-07 19:52:01+00:00, Same  I am not supposed to have coffee but I just had one regular cup. Like whateven.,0,0,Khairdaykana,218,Lahore,2,SC
2023-01-07 19:33:01+00:00,My twitter surely is a suicidal diary. Who knows.,0,0,Khairdaykana,218,Lahore,2,SC
2023-01-07 19:32:42+00:00,im  doing  really  well  today!  (IM  SO  TIRED  OF  BEING  IN  PAIN  ALL  THE  TIME  I  HATE  MYSELF  I  HATE  B ,0,0,Khairdaykana,218,Lahore,2,SC
2023-01-07 16:48:55+00:00,"the  good  thing  about  feeling  in  extremes  is  when  i  love,  i  give  them  wings.  perhaps  that  isn't  su ",0,1,Khairdaykana,218,Lahore,0,SC
2023-01-07 16:47:54+00:00,i  knew  that  he  was  always  going  to  be  number  one.  even  if  i  fell  in  love  with  a  pretty  petite ,0,1,Khairdaykana,218,Lahore,0,SC
2023-01-07 16:46:03+00:00,"youre  so  upset  me  with,  but  im  so  obsessed  with  you.  im  fucking  crazy,  i  dont  wanna damage  you.",0,0,Khairdaykana,218,Lahore,2,SC
2023-01-07 16:39:14+00:00,tear  my  hea  to  pieces  and  ill  piece  it  back  together.  just  to  keep  the  peace  ill  suffer  with  you  for  forever.,0,0,Khairdaykana,218,Lahore,2,SC
2023-01-07 21:24:10+00:00,"she  was  pretty,  but  i  never  needed  to  force  myself  to  stop  staring.  i  liked  kissing  her,  but  neve ",1,0,borderlinevomit,1015,lyrics + quotes every 10m,0,SI
2023-01-08 03:25:04+00:00,do  you  like  music?  do  you  like  breathing?,0,0,borderlinevomit,1014,lyrics + quotes every 10m,0,SI
2023-01-08 03:15:10+00:00,pretty  face  with  pretty  bad  dreams.  no  one  knows  i  cry  in  my  sleep.  waking  up  feeling  like  shit. ,0,0,borderlinevomit,1014,lyrics + quotes every 10m,2,SI
2023-01-08 03:05:38+00:00,"but  the  sad  truth  is,  there  is  no  right  person,  wrong  time,  because  the  right  person  will stay  n ",0,1,borderlinevomit,1014,lyrics + quotes every 10m,1,SI
2023-01-08 02:54:56+00:00,being  hypersexual  while  also  being  repulsed  by  the  idea  of  sexual  intercourse  is  one  hell  of  a  drug.,1,0,borderlinevomit,1014,lyrics + quotes every 10m,2,SI
2023-01-08 02:45:00+00:00,you  never  seem  to  call  me  lately.,1,3,borderlinevomit,1014,lyrics + quotes every 10m,2,SI
2023-01-08 02:34:44+00:00,"because  he  is  a  fool.  but  he  is  a  fool  full  of  love,  a  love  that  should  be  shared  with  the  wor ",0,1,borderlinevomit,1014,lyrics + quotes every 10m,1,SI
2023-01-08 02:24:57+00:00,everyones  attractive  to  be  honest.  even  if  its  just  something  small.  likesome  people  have  really ,2,3,borderlinevomit,1014,lyrics + quotes every 10m,0,SI
2023-01-08 02:15:21+00:00,its  alright  to  not  be  fine  on  your  own.,1,0,borderlinevomit,1014,lyrics + quotes every 10m,0,SI
2023-01-08 02:05:05+00:00,"i  love  your  personality!  thanks,  its  a  disorder.",1,2,borderlinevomit,1014,lyrics + quotes every 10m,0,SI
2023-01-08 01:55:02+00:00,"all  i  want  is  you  now,  all  i  wanna  do  now  is  wait  for  you  to  call  me.",1,0,borderlinevomit,1014,lyrics + quotes every 10m,2,SI
2023-01-08 01:45:24+00:00,"of  all  the  tragedies  on  eah,  there  is  nothing  more  tragic  than  a  person  who  cannot  see  their  woh.",0,1,borderlinevomit,1014,lyrics + quotes every 10m,2,SI
2023-01-08 01:35:32+00:00,"do  you  ever  feel  stupid?  like,  really  stupid?  so  goddamn  stupid",1,1,borderlinevomit,1014,lyrics + quotes every 10m,2,SI
2023-01-08 01:24:53+00:00,"so  please  listen  clearly,  i  love  you  dearly,  it  hus  to  see  you  so  torn  apa  like  this.  another ",0,1,borderlinevomit,1014,lyrics + quotes every 10m,1,SI
2023-01-08 01:15:16+00:00,do  not  enter  is  written  on  the  doorway.  why  cant  everyone  just  go  away?  except  you.  you  could  stay.,7,6,borderlinevomit,1014,lyrics + quotes every 10m,2,SI
2023-01-08 01:04:54+00:00,you  could  have  anyone  you  want.  why  would  you  wanna  be  with  me?  im  nothing  special.,1,4,borderlinevomit,1014,lyrics + quotes every 10m,2,SI
2023-01-08 00:55:13+00:00,If I still feel like k1ll1ng myself on my bday I will do it cause Im tired of living in a house where I am like a toy,0,0,borderlinevomit,1014,lyrics + quotes every 10m,2,SI
2023-01-08 00:45:10+00:00, Omgg thank you,4,6,borderlinevomit,1014,lyrics + quotes every 10m,0,SI
2023-01-08 00:34:40+00:00, Ohh ok makes sense but I just never go to shoprite ,0,0,borderlinevomit,1014,lyrics + quotes every 10m,2,SI
2023-01-08 00:24:33+00:00,I didn't lose any weight this holiday I gained a lil even but I'm not binging everyday so that's relieving I will d ,0,0,borderlinevomit,1014,lyrics + quotes every 10m,0,SI
2023-01-08 00:14:47+00:00, Where did you get them I've not even seen them in like spar,2,4,borderlinevomit,1014,lyrics + quotes every 10m,2,SI
2023-01-07 21:19:53+00:00,11 days binge free I'm so close to two weeks :),0,0,depr1v3d_,282,| he/they|15 muslim| vent/,0,SC
2023-01-07 21:55:28+00:00, or I will cry,0,1,depr1v3d_,282,| he/they|15 muslim| vent/,2,SC
2023-01-07 21:46:51+00:00,I wish my dad liked me i wished my mum was nicer and like listened to me. I wish he wasn't so abus1ve I wish my lif ,0,1,depr1v3d_,282,| he/they|15 muslim| vent/,1,SC
2023-01-07 21:45:38+00:00,If I still feel like killing myself on my bday I will do it cause I'm tired of living in a house where I am like a toy,0,0,depr1v3d_,282,| he/they|15 muslim| vent/,2,SC
2023-01-07 21:43:41+00:00,I overate but like with my cramps I'm experiencing I'd have usually eaten the entire house I sha ate under my tree today,0,1,depr1v3d_,282,| he/they|15 muslim| vent/,2,SC
2023-01-07 21:40:44+00:00,I'm having the worst period cramps and my pain meds got seized,0,0,depr1v3d_,282,| he/they|15 muslim| vent/,2,SC
2023-01-07 21:38:42+00:00, Thanks,0,1,depr1v3d_,282,| he/they|15 muslim| vent/,0,SC
2023-01-07 21:19:54+00:00,Released a new Ed vlog I try my best so suppo me :),0,0,depr1v3d_,282,| he/they|15 muslim| vent/,0,SC
2023-01-07 21:19:53+00:00, Me,0,0,depr1v3d_,282,| he/they|15 muslim| vent/,1,SC
2023-01-07 20:07:55+00:00,  cure ds or .CURE DS CURE ALL OF THEM,0,1,depr1v3d_,282,| he/they|15 muslim| vent/,1,SC
2023-01-07 19:46:34+00:00, Hi,0,2,depr1v3d_,282,| he/they|15 muslim| vent/,0,SC
2023-01-07 19:35:40+00:00," I do mealplans
Workouts
Cal counts and my measurements",0,1,depr1v3d_,282,| he/they|15 muslim| vent/,0,SC
2023-01-07 19:30:29+00:00, Yess,0,4,depr1v3d_,282,| he/they|15 muslim| vent/,0,SC
2023-01-07 13:58:36+00:00,"You will lose weight just work hard
Nobody works as hard that's why you all are fat
At this rate yall could be alph ",0,0,depr1v3d_,282,| he/they|15 muslim| vent/,2,SC
2023-01-07 13:56:12+00:00,Sometimes yall sound like capitalists on here,2,0,depr1v3d_,282,| he/they|15 muslim| vent/,2,SC
2023-01-07 13:51:06+00:00,10 days binge free lost all my period bloat and over eating weight I'm gonna sta the 7 day exercise challenge now :) I've made it so far,0,0,depr1v3d_,282,| he/they|15 muslim| vent/,0,SC
2023-01-07 13:36:51+00:00,no fr. im sick and tired of people who arent depressed thinking that they understand what its like just because ,0,0,depr1v3d_,282,| he/they|15 muslim| vent/,2,SC
2023-01-07 12:37:57+00:00,  the rent was due. the lights were flickering. the eviction notice was at the front door. he had ONE chance and a dream.,0,2,depr1v3d_,282,| he/they|15 muslim| vent/,2,SC
2023-01-07 11:31:25+00:00, a national treasure no ones talked about him in months,0,6,depr1v3d_,282,| he/they|15 muslim| vent/,1,SC
2023-01-07 11:31:24+00:00,people will be like i had to drop my depressed friend because they refused to get better as if not wanting to get ,0,3,depr1v3d_,282,| he/they|15 muslim| vent/,2,SC
2023-01-07 09:24:32+00:00,no fr. im sick and tired of people who arent depressed thinking that they understand what its like just because ,0,0,depr1v3d_,282,| he/they|15 muslim| vent/,2,SC
2023-01-07 21:10:37+00:00, oh wow!!,0,0,kenobifilms,858,she/her 18,0,SI
2023-01-07 22:00:37+00:00,  why has every kill bill cover ive heard sucked like not everyone got the szalent.,2524,0,kenobifilms,858,she/her 18,2,SI
2023-01-07 21:59:57+00:00,kai-lan SOLOS ,0,1,kenobifilms,858,she/her 18,0,SI
2023-01-07 21:12:24+00:00, that man is my husband please delete these photos immediately,0,1,kenobifilms,858,she/her 18,2,SI
2023-01-07 21:06:47+00:00, i didnt sta doing well in school until like halfway through sophomore year &amp; even then i wasnt perfe ,0,0,kenobifilms,858,she/her 18,2,SI
2023-01-07 21:03:54+00:00, no fr i was beginning to think i didnt have enough either HAHA,141,0,kenobifilms,858,she/her 18,1,SI
2023-01-07 07:00:27+00:00,  thank u!!!!,0,0,kenobifilms,858,she/her 18,0,SI
2023-01-07 06:33:21+00:00,average moulin rouge fan ,0,0,kenobifilms,858,she/her 18,0,SI
2023-01-07 06:31:18+00:00,guys WHERE is my letterboxd wrapped,10763,0,kenobifilms,858,she/her 18,2,SI
2023-01-07 06:29:21+00:00,they need to adveise it like this cause this tweet alone made me want to read it ,0,0,kenobifilms,858,she/her 18,0,SI
2023-01-07 02:27:10+00:00,  PLSSSSS LMAO,0,0,kenobifilms,858,she/her 18,0,SI
2023-01-07 02:26:55+00:00,i love how the main offense from the liberal is immature and then for the conservative its racist jerk ,0,0,kenobifilms,858,she/her 18,1,SI
2023-01-07 02:26:49+00:00, its because sexy priest. hope this helps,0,1,kenobifilms,858,she/her 18,0,SI
2023-01-06 23:31:13+00:00,i want a cat :( im destined to be a cat mom we would be best friends i just know it,1,1,kenobifilms,858,she/her 18,1,SI
2023-01-06 22:55:30+00:00,hes like me fr ,0,1,kenobifilms,858,she/her 18,0,SI
2023-01-06 06:22:38+00:00, NAW MANE WHAT THE FUCK IM TIRED OF LIVING HERE  ,0,38,kenobifilms,858,she/her 18,2,SI
2023-01-05 20:56:47+00:00,WHERE DID ALL OF YOU COME FROM,0,8,kenobifilms,858,she/her 18,2,SI
2023-01-05 20:54:23+00:00,I am currently being dopiled on for saying to shut up cuz it makes no sense ,0,1,kenobifilms,858,she/her 18,2,SI
2023-01-05 20:53:02+00:00,I haven't seen a valid point brought up..... that's the problem ,0,1,kenobifilms,858,she/her 18,2,SI
2023-01-05 20:51:01+00:00,Why does everyone like me all of a sudden I'm just gaining followers ,0,0,kenobifilms,858,she/her 18,0,SI
2023-01-07 21:01:52+00:00,  They keep putting them for limited time and they keep selling out first day but I just want them man ,2,8,rayherogaming,89,He/They,2,SI
2023-01-08 03:19:29+00:00, Mind boggling,0,0,rayherogaming,89,He/They,0,SI
2023-01-08 03:18:34+00:00, THAT'S A WOMAN!?!?,0,2,rayherogaming,89,He/They,1,SI
2023-01-08 03:17:57+00:00, DEB'S A GIRL!?!????,0,0,rayherogaming,89,He/They,0,SI
2023-01-07 22:01:56+00:00, THIS IS SO COOL :0,0,0,rayherogaming,89,He/They,0,SI
2023-01-07 21:48:54+00:00, Oreo?????,0,0,rayherogaming,89,He/They,0,SI
2023-01-07 21:43:26+00:00, Your a makes me mind boggled,0,0,rayherogaming,89,He/They,0,SI
2023-01-07 21:39:59+00:00,"  hysteria 
[ # # # # ] ",0,1,rayherogaming,89,He/They,0,SI
2023-01-07 21:36:53+00:00, NAW MANE WHAT THE FUCK I'M TIRED OF LIVING HERE  ,0,0,rayherogaming,89,He/They,2,SI
2023-01-07 21:36:46+00:00, Who is that on the left,0,0,rayherogaming,89,He/They,1,SI
2023-01-07 21:35:49+00:00, Technically even in creative mode Steve dies when falling into The End so theoretically no?,0,0,rayherogaming,89,He/They,2,SI
2023-01-07 21:09:25+00:00, I. Need. This. Mug. At. An. Instant.,0,1,rayherogaming,89,He/They,2,SI
2023-01-07 21:09:17+00:00,  BRO JUST KNOCKED UP THE WHOLE ASS CITY AND LEFT!! MY FAMILY'S DEAD!!!! ,7,0,rayherogaming,89,He/They,2,SI
2023-01-07 21:01:52+00:00,  Usually people make Sonic Characters without their shoes or gloves on weird (to be fair I ,2,8,rayherogaming,89,He/They,2,SI
2023-01-07 20:51:42+00:00, Won't read me a bedtime story &gt;:( ,0,0,rayherogaming,89,He/They,2,SI
2023-01-07 20:25:52+00:00, shitman,0,1,rayherogaming,89,He/They,2,SI
2023-01-07 20:20:28+00:00,Religion is so fucking annoying lmao. Christians are annoying. Muslims are annoying. Catholics are annoying. Theyr ,0,2,rayherogaming,89,He/They,2,SI
2023-01-07 20:15:44+00:00," ""They're 15"" yeah that means they're... Age appropriate..? They're both the same age. what is the probl ",0,50,rayherogaming,89,He/They,0,SI
2023-01-07 20:14:42+00:00, I requested a refund lol,0,4,rayherogaming,89,He/They,2,SI
2023-01-07 18:29:46+00:00,"*buys Back Scatter so I can craft Panic Attack*

*can't use it for crafting*",0,1,rayherogaming,89,He/They,2,SI
2023-01-07 18:21:37+00:00,  Honestly idc that much unless I see it on tiktok or something quoting the Bible b ,0,1,rayherogaming,89,He/They,1,SI
2023-01-07 20:55:47+00:00,Not to mention how so many of them (mainly Christians) try to tell you what to do because their stupid little story ,0,0,_d1sapp3ar_,103,ohio :(,2,SI
2023-01-08 00:07:55+00:00,Religion is so fucking annoying lmao. Christians are annoying. Muslims are annoying. Catholics are annoying. They'r ,0,1,_d1sapp3ar_,103,ohio :(,1,SI
2023-01-07 23:39:27+00:00, AJ is so cute in this form,0,0,_d1sapp3ar_,103,ohio :(,0,SI
2023-01-07 23:35:12+00:00, Person: I literally do not want to be alive. I want to k1ll myself and see no purpose of being alive or d ,0,1,_d1sapp3ar_,103,ohio :(,2,SI
2023-01-07 23:34:15+00:00, I literally don't give a shit lmao. I like the show. If you don't too bad,0,2,_d1sapp3ar_,103,ohio :(,1,SI
2023-01-07 20:56:36+00:00,"Daddy- er, I mean, Professor Stein doodle. ",0,0,_d1sapp3ar_,103,ohio :(,0,SI
2023-01-07 20:55:47+00:00,  Year of the bnuy ,0,0,_d1sapp3ar_,103,ohio :(,0,SI
2023-01-07 20:22:38+00:00,"  Quick warmup sketch Of Eleanor. 
Ive been wanting to draw her for quite some time now # belongs to ",0,0,_d1sapp3ar_,103,ohio :(,0,SI
2023-01-07 20:22:03+00:00, I'd never,0,16,_d1sapp3ar_,103,ohio :(,2,SI
2023-01-06 19:06:48+00:00,  Retweet if you breathe oxygen.,1,6,_d1sapp3ar_,103,ohio :(,0,SI
2023-01-06 18:10:29+00:00,  teeth out thursday ,1695,0,_d1sapp3ar_,103,ohio :(,0,SI
2023-01-06 17:15:36+00:00,"  Day 3,437

There is no confirmation of a Soul Eater reboot.

Soul plays the piano. ",0,1,_d1sapp3ar_,103,ohio :(,2,SI
2023-01-06 17:11:15+00:00, Ok? He should get over it lmao,567,0,_d1sapp3ar_,103,ohio :(,0,SI
2023-01-06 17:09:41+00:00,i might have to become one of these meal prep bitches cuz im tired of living like this,1938,0,_d1sapp3ar_,103,ohio :(,2,SI
2023-01-06 17:09:37+00:00,lucky girl syndrome is soooo real idc,324,0,_d1sapp3ar_,103,ohio :(,0,SI
2023-01-06 16:45:49+00:00,i might have to become one of these meal prep bitches cuz im tired of living like this,32,0,_d1sapp3ar_,103,ohio :(,2,SI
2023-01-06 16:32:55+00:00,i cant explain it but i feel sooooo sexy when my muscles are sore,0,0,_d1sapp3ar_,103,ohio :(,0,SI
2023-01-07 20:45:15+00:00,paid rent and have $100 left to my name ): im so tired of living like this,0,44,squishyyandere,13451,"Los Angeles, CA",2,SC
2023-01-08 00:55:13+00:00,update : theyre on my patio now!!,0,6,squishyyandere,13451,"Los Angeles, CA",0,SC
2023-01-08 00:53:50+00:00,"just to update, they dont want to go onto my patio so i have to put the tote over behind a locked gate at my compl ",0,16,squishyyandere,13451,"Los Angeles, CA",2,SC
2023-01-07 21:43:20+00:00,i cant wait to be dancing behind him when he plays his first gig (after every gig after!) ,0,2,squishyyandere,13451,"Los Angeles, CA",0,SC
2023-01-07 21:08:36+00:00,"thussy so good im thinking about our future together. -  , 2k23",0,2,squishyyandere,13451,"Los Angeles, CA",0,SC
2023-01-07 20:46:28+00:00,the LOAD i just received ,0,14,squishyyandere,13451,"Los Angeles, CA",0,SC
2023-01-07 20:45:15+00:00,"(im okay, this is normal for me)",0,44,squishyyandere,13451,"Los Angeles, CA",0,SC
2023-01-07 04:50:28+00:00,my hip popped out in my sleep last night and it hu. today im working a cold storage and stepped on ice and *pop* went my hip. ,0,14,squishyyandere,13451,"Los Angeles, CA",1,SC
2023-01-07 03:33:55+00:00,"btw if you ever need to build a shelter for a homeless kitty: use a plastic tote, put a styrofoam ice chest inside, ",0,12,squishyyandere,13451,"Los Angeles, CA",0,SC
2023-01-07 02:29:27+00:00,shelter is outside. food is under the little awning i made in hopes that theyll smell it and find the shelter. il ,0,28,squishyyandere,13451,"Los Angeles, CA",0,SC
2023-01-07 01:55:14+00:00, i will update in the morning ,0,17,squishyyandere,13451,"Los Angeles, CA",0,SC
2023-01-07 01:55:13+00:00,"i am building them a shelter out of a tote &amp; and ice chest rn heres to hoping if i put food inside it, theyll smell it and go inside ",1,80,squishyyandere,13451,"Los Angeles, CA",0,SC
2023-01-06 17:04:18+00:00,"the homeless kitty in my complex has been behind my bedroom since the rain began, sitting on the only dry patch of di they can find :(",0,7,squishyyandere,13451,"Los Angeles, CA",2,SC
2023-01-06 17:04:04+00:00,"  Tired of living in DC hotels apparently, DCs answer .  I am glad she can have aplace of her own.",0,22,squishyyandere,13451,"Los Angeles, CA",2,SC
2023-01-06 05:31:13+00:00,Somewhere - The Best Duet Ever  via ,1,26,squishyyandere,13451,"Los Angeles, CA",0,SC
2023-01-06 04:26:54+00:00," Who Care's,  maybe the people that voted for him.",0,24,squishyyandere,13451,"Los Angeles, CA",2,SC
2023-01-07 20:41:53+00:00, Whatever.  Like its hard work appeasing people to get your votes.,0,0,AdamRager,40,"Alexandria, VA",1,SI
2023-01-07 23:09:09+00:00,  I am sure that helps his district immensly.,0,0,AdamRager,40,"Alexandria, VA",0,SI
2023-01-07 22:58:04+00:00, WHO CARES,0,0,AdamRager,40,"Alexandria, VA",2,SI
2023-01-07 21:01:51+00:00," Thank God you shared this, I can finally sleep at night.",0,0,AdamRager,40,"Alexandria, VA",0,SI
2023-01-07 20:57:19+00:00, Why is this news wohy..?  oh wait its twitter.,0,0,AdamRager,40,"Alexandria, VA",0,SI
2023-01-07 20:52:27+00:00, He must think Americans actually give a shit.,0,0,AdamRager,40,"Alexandria, VA",1,SI
2023-01-07 20:51:41+00:00,"  Tired of living in DC hotels apparently, DCs answer .  I am glad she can have aplace of her own.",0,0,AdamRager,40,"Alexandria, VA",2,SI
2023-01-07 20:48:42+00:00," WHO CARE's  :)  Poor baby, son of the King. Enjoy your life and quit bitchin.",0,0,AdamRager,40,"Alexandria, VA",0,SI
2023-01-07 20:47:53+00:00, No Wonder I got as many dates as i do.  hmmm,0,0,AdamRager,40,"Alexandria, VA",1,SI
2023-01-07 20:47:22+00:00, There is so much DRAMA  I could light myself on fire. ,0,0,AdamRager,40,"Alexandria, VA",2,SI
2023-01-07 20:46:27+00:00, It is the cars.,0,0,AdamRager,40,"Alexandria, VA",0,SI
2023-01-07 20:45:21+00:00, Are the citizens in her Distric clueless?  WTH why would they keep voting for her.  Their problem i guess.,0,0,AdamRager,40,"Alexandria, VA",2,SI
2023-01-07 20:41:53+00:00,Shalamar - The Second Time Around (Official Music Video)  via ,0,0,AdamRager,40,"Alexandria, VA",0,SI
2023-01-07 20:35:47+00:00, Well apparently they do.,0,0,AdamRager,40,"Alexandria, VA",0,SI
2023-01-07 20:34:37+00:00,one thing that youd never hear me say is that Im tired of living / funny thing that statement change today,0,0,AdamRager,40,"Alexandria, VA",2,SI
2023-01-07 20:26:29+00:00,A THOU JUST GOING TO LEAVETH ME HERE!?,0,0,AdamRager,40,"Alexandria, VA",2,SI
2023-01-07 20:25:41+00:00,KILL YOURSELF: there's not enough room for the two of us,0,0,AdamRager,40,"Alexandria, VA",2,SI
2023-01-07 20:23:26+00:00,"but, heh... let's see if you don't lose your head by the end of this.",0,0,AdamRager,40,"Alexandria, VA",0,SI
2023-01-07 20:11:51+00:00,i can't lose you. not again,0,0,AdamRager,40,"Alexandria, VA",2,SI
2023-01-07 20:11:04+00:00,"I bid you farewell, my first and last friend.",0,0,AdamRager,40,"Alexandria, VA",1,SI
2023-01-07 20:10:29+00:00, This is what nobunaga envisioned when he was conquering japan,0,5,Ohneisan,336,The Netherlands,0,SI
