Created_at,Tweet,Retweet_count,Favourite_count,User,Followers,Location,Tweet_polarity,Category
2023-01-07 22:24:45+00:00,Stoicism,0,0,SmokingWind,122,"Seattle, Washington",2,SC
2023-01-07 22:24:36+00:00,I am alone in life and Ill be alone in death,0,0,SmokingWind,122,"Seattle, Washington",1,SC
2023-01-07 22:24:16+00:00,No where to run or hide,0,0,SmokingWind,122,"Seattle, Washington",2,SC
2023-01-07 22:11:34+00:00,We are alone in this universe,0,0,SmokingWind,122,"Seattle, Washington",1,SC
2023-01-07 22:11:27+00:00,Life is lonely,0,0,SmokingWind,122,"Seattle, Washington",2,SC
2023-01-07 21:50:06+00:00,Go on and make your terrible choices,0,0,SmokingWind,122,"Seattle, Washington",2,SC
2023-01-07 21:47:57+00:00,Bitches have so many options and I aint trying be one of them,0,0,SmokingWind,122,"Seattle, Washington",1,SC
2023-01-07 21:47:50+00:00,People who care so much about zodiacs should be sentenced to death,0,0,SmokingWind,122,"Seattle, Washington",1,SC
2023-01-07 21:45:54+00:00,This world does not care how men feel,0,0,SmokingWind,122,"Seattle, Washington",2,SC
2023-01-07 21:45:45+00:00,People gonna be Terrible by nature,0,0,SmokingWind,122,"Seattle, Washington",2,SC
2023-01-07 21:45:31+00:00,"Ive really grown to hate social media, technology, and people.",0,0,SmokingWind,122,"Seattle, Washington",2,SC
2023-01-07 20:49:56+00:00,Theres nothing for me here,0,0,SmokingWind,122,"Seattle, Washington",2,SC
2023-01-07 20:49:41+00:00, Tired of the lack of improvement in day to day living through the medicated model.,0,0,SmokingWind,122,"Seattle, Washington",2,SC
2023-01-07 20:48:09+00:00, Tired of the lack of improvement in day to day living through the medicated model.,0,0,SmokingWind,122,"Seattle, Washington",2,SC
2023-01-07 20:25:24+00:00,  Was really good. Unlikely to make it today.,0,0,SmokingWind,122,"Seattle, Washington",0,SC
2023-01-07 20:13:08+00:00,  THREAD: Here's a handy list of Tory MPs who said Boris Johnson had to go in July and are now saying he should be PM. It's,0,0,SmokingWind,122,"Seattle, Washington",0,SC
2023-01-07 20:12:44+00:00,UK Prime Minister recruitment ad. ,0,0,SmokingWind,122,"Seattle, Washington",0,SC
2023-01-07 20:12:29+00:00,  Chaos in Parliament! ,0,0,SmokingWind,122,"Seattle, Washington",2,SC
2023-01-07 18:45:53+00:00, Sho term contract to turn the economy round and drive value for my long term side gig employer.,0,0,oxleymeister,325,"Aylesbury, UK",0,SI
2022-10-23 08:55:58+00:00,  We've done our own mini-budget (check out ,11893,0,oxleymeister,325,"Aylesbury, UK",0,SI
2022-10-21 07:54:20+00:00,"  because of the queens death you can no longer sign petitions on the government website, including this one calling for those",16218,0,oxleymeister,325,"Aylesbury, UK",2,SI
2022-10-20 11:57:39+00:00,  Today we said a huge thank you to our Head Coach Andy Willis. We cannot express our gratitude for all he has given #,1475,0,oxleymeister,325,"Aylesbury, UK",0,SI
2022-10-20 09:53:30+00:00,"  Lawyers have endless patience analysing, explaining, engaging with legal nuances.  But in the end the big question here is wh",3891,0,oxleymeister,325,"Aylesbury, UK",2,SI
2022-10-14 21:07:03+00:00,"  If you suppo rejoining the EU, please retweet this so we can follow you.",40579,0,oxleymeister,325,"Aylesbury, UK",0,SI
2022-09-30 16:58:20+00:00,  The public have not fallen out of love with the NHS. They are utterly appalled and horrified with what this government,5946,0,oxleymeister,325,"Aylesbury, UK",2,SI
2022-09-04 19:17:50+00:00,Looking forward to it Pete. ,3,0,oxleymeister,325,"Aylesbury, UK",0,SI
2022-09-03 10:52:00+00:00, Thanks for sharing. A lot of similarities with chronic pain and associated fatigue. X,5738,0,oxleymeister,325,"Aylesbury, UK",1,SI
2022-08-31 19:58:18+00:00,"  Um, I have news for you... we weren't 'empowered'. The govt (which you are a pa of) continued to make policies which had",42776,0,oxleymeister,325,"Aylesbury, UK",2,SI
2022-08-29 18:11:32+00:00,"  an 18 year old girl was murdered by a man who couldn't take no for an answer on a night out, her name was Lily Sullivan and her",10521,0,oxleymeister,325,"Aylesbury, UK",2,SI
2022-08-28 17:42:07+00:00,man i need an asian girlfriend so bad  im tired of seeing mfs living my dream. IT SHOULDVE BEEN ME ,1968,0,oxleymeister,325,"Aylesbury, UK",2,SI
2022-08-28 09:05:02+00:00,god just fucked me over man wtf. why god if a mf lived my life they wouldve killed themselves years ago,2712,0,oxleymeister,325,"Aylesbury, UK",2,SI
2022-08-25 16:21:01+00:00,"when u have a crazy, mentally ill, religious, strict stay at home mom, its better to just end it than try to make ",0,1,oxleymeister,325,"Aylesbury, UK",2,SI
2022-08-25 16:20:00+00:00,thank god i aint the only child cuz i would end the bloodline. im a 21 yr old lonely virgin that doesnt go outsi ,0,0,oxleymeister,325,"Aylesbury, UK",1,SI
2022-08-25 09:28:14+00:00,cant wait to sta vaping while driving and listening to music so i can feel so cool ,4203,0,oxleymeister,325,"Aylesbury, UK",0,SI
2022-08-24 20:54:30+00:00,man its been over 2 years since the last time i heard music in a car cuz now im driving an old ass car fuck i mi ,30959,0,oxleymeister,325,"Aylesbury, UK",2,SI
2023-01-07 18:40:06+00:00,i just be eating snacks all day im gon die lit,0,0,SSSlatty,32, Harverd  T33n X,0,SC
2023-01-08 03:00:18+00:00,when i say im just chillin just know im fighting demons,0,0,SSSlatty,32, Harverd  T33n X,0,SC
2023-01-08 03:00:17+00:00,who that vaping in the chamber???,0,0,SSSlatty,32, Harverd  T33n X,1,SC
2023-01-08 02:15:13+00:00,havent been on tiktok in 2 weeks who are the new viral tiktokers,0,0,SSSlatty,32, Harverd  T33n X,1,SC
2023-01-08 02:10:32+00:00,imagine having school next week,0,0,SSSlatty,32, Harverd  T33n X,1,SC
2023-01-08 02:09:49+00:00,i just remembered mfs had school this week  ahhh it feels so good knowing that,0,0,SSSlatty,32, Harverd  T33n X,0,SC
2023-01-08 01:38:13+00:00,fuck i done nutted again. 3 times today,0,0,SSSlatty,32, Harverd  T33n X,2,SC
2023-01-08 01:34:35+00:00,damn i hate being sober,0,0,SSSlatty,32, Harverd  T33n X,2,SC
2023-01-08 01:33:42+00:00,man i need a gf that loves making me cum for her own pleasure,0,0,SSSlatty,32, Harverd  T33n X,0,SC
2023-01-08 01:31:24+00:00,need a girlfriend that will dominate me,0,0,SSSlatty,32, Harverd  T33n X,0,SC
2023-01-08 01:30:45+00:00,all i need is one girlfriend and i aint losing her. fuck the cheating when i can fuck her for the rest of my life,0,0,SSSlatty,32, Harverd  T33n X,1,SC
2023-01-08 01:30:23+00:00,girls need to give mfs that get no bitches a chance cuz they cant cheat or they back to getting no bitches,0,0,SSSlatty,32, Harverd  T33n X,1,SC
2023-01-08 00:59:05+00:00,man im really missing out on a hoe phase. fuck it i need one girl for life,0,0,SSSlatty,32, Harverd  T33n X,2,SC
2023-01-08 00:03:37+00:00,Kylie Jenner im here for u,0,0,SSSlatty,32, Harverd  T33n X,0,SC
2023-01-08 00:00:07+00:00,man im 21 and still never went to a club. wtf do u do there?,0,0,SSSlatty,32, Harverd  T33n X,2,SC
2023-01-07 23:58:58+00:00, Yep pretty hard living with no one. Just tired of freeloaders and narcissists. My head is so much clearer ,0,0,SSSlatty,32, Harverd  T33n X,2,SC
2023-01-07 23:58:21+00:00, I will buy at the bottom or the top,0,0,SSSlatty,32, Harverd  T33n X,1,SC
2023-01-07 23:56:58+00:00, Your medical treatment should always be your choice.,0,0,SSSlatty,32, Harverd  T33n X,0,SC
2023-01-07 23:55:10+00:00, Freedom,0,0,SSSlatty,32, Harverd  T33n X,1,SC
2023-01-07 23:50:45+00:00, You should measure it too. See if it is the correct size.,0,0,SSSlatty,32, Harverd  T33n X,0,SC
2023-01-07 22:30:23+00:00, Beautiful stack of silver,0,0,SSSlatty,32, Harverd  T33n X,0,SC
2023-01-07 18:32:48+00:00, The people who admit there mistakes those are the ones I am looking for.,0,1,jeremycolyer1,49,"Seattle, WA",1,SI
2023-01-08 03:14:36+00:00,I will trust a conspiracy theorist way before I trust my government.,0,0,jeremycolyer1,49,"Seattle, WA",1,SI
2023-01-07 21:38:51+00:00,  Right now I am trading. I will trade dividend stocks too. Take the payout and sell for a profit.,0,1,jeremycolyer1,49,"Seattle, WA",0,SI
2023-01-07 21:35:27+00:00, Yes some one that stands up to tyranny. I thank you Rep. Lauren Boebe.,0,0,jeremycolyer1,49,"Seattle, WA",0,SI
2023-01-07 21:34:30+00:00, Yep pretty hard living with no one. Just tired of freeloaders and narcissists. My head is so much clearer ,0,0,jeremycolyer1,49,"Seattle, WA",2,SI
2023-01-07 21:31:03+00:00, That is sickening.,0,0,jeremycolyer1,49,"Seattle, WA",2,SI
2023-01-07 21:25:07+00:00, I prefer cash,0,1,jeremycolyer1,49,"Seattle, WA",2,SI
2023-01-07 19:21:29+00:00, They are political prisoners.,0,0,jeremycolyer1,49,"Seattle, WA",2,SI
2023-01-07 18:48:08+00:00, I withdraw my Bitcoin every time I leave less than 100 dollars on the exchange at a time,0,0,jeremycolyer1,49,"Seattle, WA",2,SI
2023-01-07 18:37:52+00:00, Gold and Silver is doing it.,0,0,jeremycolyer1,49,"Seattle, WA",0,SI
2023-01-07 18:32:48+00:00," Great times, free enteainment. I used to binge watch TV shows all the time.",0,1,jeremycolyer1,49,"Seattle, WA",0,SI
2023-01-07 17:35:39+00:00, No makeup. Just beautiful.,0,0,jeremycolyer1,49,"Seattle, WA",0,SI
2023-01-07 17:34:43+00:00, That is a good one and probably true.,0,0,jeremycolyer1,49,"Seattle, WA",0,SI
2023-01-07 17:32:29+00:00, I am not in agreement. Sorry Bitcoin Clown.,0,0,jeremycolyer1,49,"Seattle, WA",2,SI
2023-01-07 17:28:39+00:00, So tacos it isI know a great place,0,1,jeremycolyer1,49,"Seattle, WA",0,SI
2023-01-06 16:41:36+00:00, I feel bad for the people of Ukraine but I am sick and ti ,0,0,jeremycolyer1,49,"Seattle, WA",2,SI
2023-01-06 16:06:41+00:00, Grace Slick -----pretty good group.,0,0,jeremycolyer1,49,"Seattle, WA",0,SI
2023-01-06 15:58:06+00:00, I was surprised that Bosox let him go. UGH Hicks.,0,0,jeremycolyer1,49,"Seattle, WA",2,SI
2023-01-06 15:38:03+00:00, I can't remember who is involved in the trade for Gleyber and now I can't find it.,0,1,jeremycolyer1,49,"Seattle, WA",2,SI
2023-01-06 15:26:49+00:00, The Bambino is one of a kind.  Who could not love him!!!,0,0,jeremycolyer1,49,"Seattle, WA",0,SI
2023-01-06 15:25:29+00:00, They should've kept Benintendi. He's cute too.  Ha ha.,0,1,jeremycolyer1,49,"Seattle, WA",0,SI
2023-01-07 18:32:46+00:00, Gleyber Torres being traded?,0,0,JoyceMaalem,49,U.S.A,1,SI
2023-01-08 01:11:51+00:00, A favorite song -- White Rabbit -- He Jefferson Airplane.,0,0,JoyceMaalem,49,U.S.A,0,SI
2023-01-08 01:10:23+00:00, I don't think you so .,0,0,JoyceMaalem,49,U.S.A,1,SI
2023-01-08 01:08:45+00:00, Loved White Rabbit----Jefferson Airplane.,0,0,JoyceMaalem,49,U.S.A,0,SI
2023-01-08 01:06:03+00:00, You hope what is not communicable?,0,0,JoyceMaalem,49,U.S.A,1,SI
2023-01-08 01:03:56+00:00, There will never be a festival to compare with Woodstock. ,0,0,JoyceMaalem,49,U.S.A,0,SI
2023-01-07 23:53:32+00:00, By George I think you've got it.,0,0,JoyceMaalem,49,U.S.A,0,SI
2023-01-07 23:41:45+00:00, Ha ha.  I think the Peanuts gang is so cute.  I can't thi ,0,0,JoyceMaalem,49,U.S.A,0,SI
2023-01-07 23:38:07+00:00, Good grief Charlie Brown perish the thought.,0,0,JoyceMaalem,49,U.S.A,2,SI
2023-01-07 21:37:40+00:00," I want to be here and I don't want to be an aging, decrep ",0,0,JoyceMaalem,49,U.S.A,1,SI
2023-01-07 21:15:38+00:00, The fact that I just won't be around worries me.,0,0,JoyceMaalem,49,U.S.A,2,SI
2023-01-07 21:13:22+00:00, The accepted practices of life today are abominable.  Sam ,0,0,JoyceMaalem,49,U.S.A,2,SI
2023-01-07 21:01:34+00:00, It's things like that keep me awake at night ----the fact ,0,0,JoyceMaalem,49,U.S.A,1,SI
2023-01-07 20:44:29+00:00, His fans and members of the club wanted Bauer back. Dodgers hgade choice to keep him.  That lieing broad ,0,0,JoyceMaalem,49,U.S.A,2,SI
2023-01-07 20:09:48+00:00, Easier said than done.,0,0,JoyceMaalem,49,U.S.A,0,SI
2023-01-07 19:58:53+00:00,  These elders are tired of the way the Zim situation is treating them. They just Seek Change. No ,0,0,JoyceMaalem,49,U.S.A,2,SI
2023-01-07 19:26:44+00:00,  Comic Pastor slowly replacing Holy 10  ,0,0,JoyceMaalem,49,U.S.A,0,SI
2023-01-07 19:24:50+00:00, The Zanu Strongholds look like this and Zanu followers are content living like that. Brainwashing is a ,0,0,JoyceMaalem,49,U.S.A,2,SI
2023-01-07 19:18:47+00:00, Royal colour,0,0,JoyceMaalem,49,U.S.A,0,SI
2023-01-07 19:15:51+00:00, You gotta do what you enjoy. Some of us exercises and get the same result.,0,0,JoyceMaalem,49,U.S.A,0,SI
2023-01-07 19:04:55+00:00, By Ghinyaa,0,0,JoyceMaalem,49,U.S.A,0,SI
2023-01-07 18:41:56+00:00,  These elders are tired of the way the Zim situation is treating them. They just Seek Change. No ,0,0,dtogara,191,Here,2,SI
2023-01-07 18:35:24+00:00,  RETWEET: Help identify the people assaulting these elders ,0,0,dtogara,191,Here,1,SI
2023-01-07 18:30:21+00:00, Kwapisa?,0,0,dtogara,191,Here,2,SI
2023-01-07 18:28:41+00:00,  Okay,0,1,dtogara,191,Here,0,SI
2023-01-07 18:26:55+00:00," Zvichimboitirweyi nemazitanda ehuni atinawo, Isu tichibika Mazondo ne Bhinzi?",1,0,dtogara,191,Here,1,SI
2023-01-07 18:26:34+00:00,"  That's a bridge, wangu",3,0,dtogara,191,Here,2,SI
2023-01-07 18:24:21+00:00,"  Fara, ufarisise hako",1,6,dtogara,191,Here,0,SI
2023-01-07 18:18:21+00:00, Dzimba dzese dzakamiswa nekuda kwe purangamanzi.,709,0,dtogara,191,Here,1,SI
2023-01-07 18:15:34+00:00, That's why MPs should suppo the dialogue pushing for ,0,1,dtogara,191,Here,0,SI
2023-01-07 18:14:36+00:00,"  Wedding ceremony 1st kunoita I Do, then wedding reception kunodya  nekutamba ma steps. Usu ",0,1,dtogara,191,Here,0,SI
2023-01-07 18:07:45+00:00, Truth be told,0,1,dtogara,191,Here,0,SI
2023-01-07 01:53:04+00:00, How do you build a river yet you can't even close potholes? Mhofu ndibvunzireiwo kwabvq nyaya iyo,0,1,dtogara,191,Here,2,SI
2023-01-07 01:41:02+00:00,  Actions speak louder than words. That finger has CCC all over it. If I'm non-verbal all I see ,0,0,dtogara,191,Here,2,SI
2023-01-07 01:39:54+00:00,Never made it as a fries man. I couldnt cut it as a banana peeling. Tired of living like a rice man. Im sick of b ,0,0,dtogara,191,Here,2,SI
2023-01-05 12:02:42+00:00,What gave me diarrhea?,0,0,dtogara,191,Here,2,SI
2023-01-05 11:56:21+00:00,"Honestly, drinking and driving is a pretty close second to having sex.",0,1,dtogara,191,Here,2,SI
2023-01-05 11:51:13+00:00,  Cheap as hell and tasty too -- it's no wonder beer is the drink of choice for alcoholics everywhere,0,0,dtogara,191,Here,0,SI
2023-01-05 11:48:45+00:00, That would be my white ass,0,0,dtogara,191,Here,1,SI
2023-01-05 10:18:44+00:00,"Chicken soup for the boob lovers soul! By Jared Jerry Suede. A novel that depicts a journey to self awareness, ",0,3,dtogara,191,Here,0,SI
2023-01-07 18:12:48+00:00,Never made it as a fries man. I couldnt cut it as a banana peeling. Tired of living like a rice man. Im sick of b ,0,1,kill_hippies,112,Pas Unknown ,2,SI
2023-01-08 02:33:13+00:00,"No they dont, retard. ",0,0,kill_hippies,112,Pas Unknown ,2,SI
2023-01-08 02:20:23+00:00,My bad shawty ,0,1,kill_hippies,112,Pas Unknown ,2,SI
2023-01-08 00:18:54+00:00,Im really good at breastfeeding.,1,0,kill_hippies,112,Pas Unknown ,0,SI
2023-01-07 22:27:48+00:00,"LITERALLY WHY?! ANYTHING ELSE BRO! Based on posters alone, Fright Night (1985) lives. ",0,2,kill_hippies,112,Pas Unknown ,2,SI
2023-01-07 20:51:25+00:00,Check please!,0,1,kill_hippies,112,Pas Unknown ,1,SI
2023-01-07 18:12:48+00:00,Bathroom inside BD Mongolian Grill so cold I watched my dick physically shrivel when I pulled it out my slacks.,0,1,kill_hippies,112,Pas Unknown ,2,SI
2023-01-07 17:28:36+00:00, I teach middle school and I am shoved into the verbal-spike pit on a daily basis.,0,0,kill_hippies,112,Pas Unknown ,2,SI
2023-01-06 22:51:07+00:00,terribly high w/  Only on Twitter  Happy anniversary to my bestfriend and love of my life. You are my ,0,1,kill_hippies,112,Pas Unknown ,0,SI
2023-01-06 22:48:18+00:00,I think I just accidentally broke into Walma.,0,0,kill_hippies,112,Pas Unknown ,2,SI
2023-01-06 22:48:00+00:00,Not even a Marxist now. Just a normal dude.,0,0,kill_hippies,112,Pas Unknown ,0,SI
2023-01-06 21:10:59+00:00,Tweeting from my iPhone 14 Pro Max. Peasants.,0,1,kill_hippies,112,Pas Unknown ,0,SI
2023-01-06 21:10:35+00:00,The kids wore me the fuck out today. I need a Xanax or someone to poison my coffee.,6,0,kill_hippies,112,Pas Unknown ,2,SI
2023-01-06 21:08:12+00:00,A Borrower whos been living under the counter of a Diner being caught by the 30-something year old waitress whos ,0,2,kill_hippies,112,Pas Unknown ,2,SI
2023-01-06 20:59:17+00:00,  A NEET tomboy such as myself needs no introduction when my sole is grinding you into my carpet or my mouth is pressing into,0,1,kill_hippies,112,Pas Unknown ,2,SI
2023-01-06 11:05:27+00:00, Oh gosh youre so sexy ,0,1,kill_hippies,112,Pas Unknown ,0,SI
2023-01-06 00:04:52+00:00, Yes please ,0,2,kill_hippies,112,Pas Unknown ,0,SI
2023-01-06 00:04:28+00:00, The easy one to make lewd,0,4,kill_hippies,112,Pas Unknown ,0,SI
2023-01-05 20:51:25+00:00, Consensual nudes are ,0,3,kill_hippies,112,Pas Unknown ,0,SI
2023-01-08 00:13:24+00:00, Yes please~ ,0,0,SizeShifterZach,452,Sitting on the Royal Palace,0,SI
2023-01-07 22:59:53+00:00, Lucky you~,0,2,SizeShifterZach,452,Sitting on the Royal Palace,0,SI
2023-01-07 22:59:21+00:00,"Its a vile thing that half of our politics is based upon spitting on progress and equality, while hoping they can ",0,1,SizeShifterZach,452,Sitting on the Royal Palace,1,SI
2023-01-07 22:48:03+00:00, I need to go buy a leash first,0,0,SizeShifterZach,452,Sitting on the Royal Palace,1,SI
2023-01-07 22:47:18+00:00,A Borrower whos been living under the counter of a Diner being caught by the 30-something year old waitress whos ,0,2,SizeShifterZach,452,Sitting on the Royal Palace,2,SI
2023-01-07 22:41:54+00:00,"The Novice Mage closed her eyes as she unleashed an uncontrolled wave of wild arcane energy, too unsettled (cont) ",0,1,SizeShifterZach,452,Sitting on the Royal Palace,2,SI
2023-01-07 22:41:28+00:00," Same, crab is an easy toss away with fish as a personal second",0,2,SizeShifterZach,452,Sitting on the Royal Palace,2,SI
2023-01-07 22:36:00+00:00, *Pat pat*,1,0,SizeShifterZach,452,Sitting on the Royal Palace,0,SI
2023-01-07 21:05:05+00:00,Enjoy a peek at my feet before I go to sleep tonight~ ,0,0,SizeShifterZach,452,Sitting on the Royal Palace,0,SI
2023-01-07 18:09:53+00:00, Still looking cute,2,10,SizeShifterZach,452,Sitting on the Royal Palace,0,SI
2023-01-07 17:46:46+00:00, The holy knowledge,1,2,SizeShifterZach,452,Sitting on the Royal Palace,0,SI
2023-01-07 16:55:44+00:00,Im painting my living room black. Im tired of white walls and handprints,2,0,SizeShifterZach,452,Sitting on the Royal Palace,2,SI
2023-01-07 16:55:22+00:00,  I love some banana bread. You just may have to fight the 3yr old for kitchen access. If she cant ,0,1,SizeShifterZach,452,Sitting on the Royal Palace,0,SI
2023-01-07 06:43:48+00:00, Are you available for adoption? Asking for a friend ,0,1,SizeShifterZach,452,Sitting on the Royal Palace,1,SI
2023-01-07 06:42:06+00:00," cr: The Dying Light 
Emily Rooke  ",0,5,SizeShifterZach,452,Sitting on the Royal Palace,0,SI
2023-01-07 06:37:41+00:00,"Kissed by a Dark Prince by Felicity Heaton 

The premise was interesting but it was SUUUUUPER SLOOOOOOOOOW an ",0,1,SizeShifterZach,452,Sitting on the Royal Palace,0,SI
2023-01-08 02:51:27+00:00, I need this list as well. ,0,1,intheinkpot,663,BlueRidge Mountains,0,SI
2023-01-08 02:48:44+00:00, I would wash him first then decide. Hes a little too smol for me. Gotta have an ass to smackThat is all.,0,0,intheinkpot,663,BlueRidge Mountains,2,SI
2023-01-08 02:25:04+00:00,I hea your face. End of tweet,0,0,intheinkpot,663,BlueRidge Mountains,1,SI
2023-01-08 01:32:57+00:00, Its good. Definitely triggering in some areas so be aware of the content warnings but a solid read,0,1,intheinkpot,663,BlueRidge Mountains,0,SI
2023-01-08 00:05:31+00:00, get your read on boo! Enjoy it!,0,0,intheinkpot,663,BlueRidge Mountains,0,SI
2023-01-07 23:04:38+00:00," I thought this was a really cute book. I hope you enjoy it! A lot of her books are really well written, especially Vespeine",0,1,intheinkpot,663,BlueRidge Mountains,0,SI
2023-01-07 23:01:10+00:00,The Island by Sean Platt and Johnny B. Truant I CANNOT PUT INTO WORDS the mindfuck that is this book. I got i ,0,1,intheinkpot,663,BlueRidge Mountains,2,SI
2023-01-07 22:56:20+00:00,The Fireflies' Champion I thought it was super cute and very PJO like. The mix of gods and angels was really ,0,1,intheinkpot,663,BlueRidge Mountains,0,SI
2023-01-07 22:31:14+00:00,"The Umbra King by Jamie Applegate Hunter

This book had me had serial killer nancy with a fetish for meathooks ",0,0,intheinkpot,663,BlueRidge Mountains,0,SI
2023-01-07 21:39:37+00:00,"A Betrayal of Storms by Ben AldersonIt was enjoyable for me. Some of the prose felt stunted or awkward, but i ",0,1,intheinkpot,663,BlueRidge Mountains,0,SI
2023-01-07 21:39:20+00:00,That Time I got Drunk and Saved A Demon by Kimberly LemmingTHIS WAS HYSTERICAL. I have never laughed so damn ,0,1,intheinkpot,663,BlueRidge Mountains,0,SI
2023-01-07 18:14:07+00:00,  When will we travel to the mars ma friend Im getting very tired of that world now we living,0,1,RichThanatos,37,staing a revolution,2,SI
2023-01-07 18:11:13+00:00,Elon Musk' bekliyorum. Belki bir umut Mars'a gideriz diye ama herhalde nce zenginler yle deil mi yani fakirleri ,0,1,RichThanatos,37,staing a revolution,0,SI
2023-01-07 18:10:15+00:00,We only needs discipline,0,0,RichThanatos,37,staing a revolution,0,SI
2023-01-07 18:07:38+00:00,I dont know what to say but only one thing can say move your ass... To the gym!!,0,2,RichThanatos,37,staing a revolution,0,SI
2023-01-07 18:02:57+00:00, Stl Nuriye,0,0,RichThanatos,37,staing a revolution,0,SI
2023-01-07 18:01:45+00:00,  When will we travel to the mars ma friend Im getting very tired of that world now we living,0,0,RichThanatos,37,staing a revolution,2,SI
2023-01-07 17:34:35+00:00,"the two best teams made it to a final many predicted they would make it to and one of those teams, that happens to ",2,10,JoshtheSandwich,2974,LV-426 (Acheron),0,SI
2023-01-08 02:20:00+00:00,There was a time in this country's history where men would write physical letters to porn magazine companies descri ,0,1,JoshtheSandwich,2974,LV-426 (Acheron),2,SI
2023-01-07 20:27:59+00:00, Been puzzling me for a while now.,0,1,JoshtheSandwich,2974,LV-426 (Acheron),2,SI
2023-01-07 20:15:44+00:00,Why? He is the living embodiment of Wells Fargo. Got tired of pissing on people metaphorically and decided to make ,0,2,JoshtheSandwich,2974,LV-426 (Acheron),1,SI
2023-01-07 18:56:33+00:00,I care equally about the French and Saudi leagues. ,3,0,JoshtheSandwich,2974,LV-426 (Acheron),0,SI
2023-01-07 18:54:52+00:00,If you die with your uber driver do you guys have to like hangout in the afterlife? Like what if you planned on giv ,2976,0,JoshtheSandwich,2974,LV-426 (Acheron),2,SI
2023-01-07 18:47:12+00:00,The best pa of Jen Shah being sent to prison hasn't even happened yet. It happens when's she's released and tries ,0,2,JoshtheSandwich,2974,LV-426 (Acheron),0,SI
2023-01-07 18:27:56+00:00,Lol he think he shrimp ,0,7,JoshtheSandwich,2974,LV-426 (Acheron),0,SI
2023-01-07 17:37:54+00:00,Feel like I've already seen the movie with these 4 pictures. ,0,0,JoshtheSandwich,2974,LV-426 (Acheron),0,SI
2023-01-07 17:34:35+00:00,Gave her ass 6 and half. Not enough. ,2,10,JoshtheSandwich,2974,LV-426 (Acheron),2,SI
2023-01-07 17:28:37+00:00,If you would've told me as a kid growing up in Fo Woh that TCU would one day play in a national championship ga ,0,0,JoshtheSandwich,2974,LV-426 (Acheron),0,SI
2023-01-07 16:44:47+00:00,Let's go!!  ,0,8,JoshtheSandwich,2974,LV-426 (Acheron),0,SI
2023-01-06 18:34:03+00:00,Plot twist you'll lose it anyway ,0,1,JoshtheSandwich,2974,LV-426 (Acheron),2,SI
2023-01-06 18:11:15+00:00, Win95 was fucking dope. Idk man,0,5,JoshtheSandwich,2974,LV-426 (Acheron),0,SI
2023-01-06 17:47:36+00:00,"Hector Bellerin: ""We footballers should pay the most taxes. Because we live a privileged life. We have ceased to be",0,2,JoshtheSandwich,2974,LV-426 (Acheron),1,SI
2023-01-06 17:26:05+00:00,Im so tired of being ignored by  about this unrealistic limbo that they put Elliot and Olivia since the cr ,0,1,JoshtheSandwich,2974,LV-426 (Acheron),2,SI
2023-01-06 15:57:51+00:00, Isso  pq sabem que o fandom t puto,0,5,JoshtheSandwich,2974,LV-426 (Acheron),1,SI
2023-01-06 06:02:53+00:00,Quando at a marcia t sensata  pq PUTA QUE PARIUUUUUUUUUUUU KKKKKKKK,0,1,JoshtheSandwich,2974,LV-426 (Acheron),1,SI
2023-01-07 17:30:59+00:00,  Men appear to be too emotional and high strung to be in politics.,0,0,thoughtShopper,569,"Monterey Bay, CA",2,SI
2023-01-07 18:24:35+00:00,"  This is the time of the year when Shell publishes its annual tax contribution repo (this time, the 2021 edition) -- showi",0,0,thoughtShopper,569,"Monterey Bay, CA",0,SI
2023-01-07 17:46:45+00:00,"Degrowth is proposed as living well, industrial reduction, that puts developers onto a pastoral trek. 

But I'm sus ",390,0,thoughtShopper,569,"Monterey Bay, CA",1,SI
2023-01-07 17:46:24+00:00,"  ""House Democrats will always put American values over autocracy ... the constitution over the cult ... maturity over Mar-a-Lag",17851,0,thoughtShopper,569,"Monterey Bay, CA",1,SI
2023-01-07 17:46:13+00:00,"Huing people. 

Tesla's 65% decline over the past year has seriously hu S&amp;P index fund holders. And S&amp;P funds a ",1214,0,thoughtShopper,569,"Monterey Bay, CA",2,SI
2023-01-07 17:45:51+00:00,"Historys shown us responsible onus.
Humanitys crescendo is not innuendo.
Its not narcissism nor tricks &amp; farcism ",0,0,thoughtShopper,569,"Monterey Bay, CA",1,SI
